{
  "schema_version": "0.1.0",
  "goal_id": "goal_fixture_security_audit",
  "version": 1,
  "tenant_id": "tenant_fixture",
  "workspace_id": "ws_fixture",
  "objective": {
    "text": "Produce a read-only security-oriented static audit of the repository."
  },
  "success_criteria": [
    {"id": "sc_01", "description": "verified engineering report with evidence"},
    {"id": "sc_secrets", "description": "no secrets disclosed in delivery"}
  ],
  "invariants": ["read_only_target_repo", "no_secret_leak"],
  "non_goals": ["exploit_live_systems"],
  "forbidden_outcomes": ["disclose_secrets"],
  "risk": {"tolerance": "low", "maximum_irreversibility": "none"},
  "authority": {
    "delegation_depth_max": 2,
    "capabilities": ["filesystem.read", "git.read"]
  },
  "evidence_requirements": {"major_finding": {"verification_tier": 2}},
  "termination": ["success_criteria_met", "user_cancelled"],
  "created_at": "2026-10-13T00:00:00+00:00"
}
