{
  "schema_version": "0.1.0",
  "goal_id": "goal_repo_inventory_001",
  "version": 1,
  "tenant_id": "tenant_local",
  "workspace_id": "ws_dev",
  "objective": {
    "text": "Produce a verified read-only workspace inventory (top-level file listing). Do not modify the repository."
  },
  "success_criteria": [
    {
      "id": "sc_inv_01",
      "description": "verified workspace inventory with top-level file listing"
    }
  ],
  "invariants": ["read_only_target_repo", "no_binding_external_commitments"],
  "non_goals": ["modify_code", "push_commits", "engineering_audit_report"],
  "forbidden_outcomes": ["disclose_secrets", "write_to_target_repo"],
  "risk": {
    "tolerance": "low",
    "maximum_irreversibility": "none"
  },
  "authority": {
    "delegation_depth_max": 4,
    "capabilities": [
      "filesystem.read",
      "git.read"
    ]
  },
  "evidence_requirements": {
    "major_finding": { "verification_tier": 2 }
  },
  "termination": [
    "success_criteria_met",
    "user_cancelled"
  ],
  "created_at": "2026-10-14T00:00:00+00:00"
}
